{
  "schema_version": 1,
  "workflow_code_metadata_key": "financeWorkflowCode",
  "source": {
    "path": "integrations/n8n/workflows",
    "file_count": 19,
    "sha256": "30498871c82a31216ef90bfcbc780068594f18ae53fc95493755566a0593b245"
  },
  "bindings": [
    {
      "placeholder": "BIND_ACTUAL",
      "credential_type": "actualBudgetApi",
      "node_type": "n8n-nodes-finance.actualBudget",
      "nodes": [
        {
          "workflow": {
            "code": "ACTUAL_OUTBOX_APPLY",
            "file": "20-actual-outbox-apply.json",
            "id": "10000000-0000-4000-8000-000000000020"
          },
          "node": {
            "id": "17010",
            "name": "Recovery Actual Preflight"
          }
        },
        {
          "workflow": {
            "code": "ACTUAL_OUTBOX_APPLY",
            "file": "20-actual-outbox-apply.json",
            "id": "10000000-0000-4000-8000-000000000020"
          },
          "node": {
            "id": "17011",
            "name": "Recovery Import PREPARED"
          }
        },
        {
          "workflow": {
            "code": "ACTUAL_OUTBOX_APPLY",
            "file": "20-actual-outbox-apply.json",
            "id": "10000000-0000-4000-8000-000000000020"
          },
          "node": {
            "id": "17012",
            "name": "Recovery Verify Actual"
          }
        },
        {
          "workflow": {
            "code": "ACTUAL_OUTBOX_APPLY",
            "file": "20-actual-outbox-apply.json",
            "id": "10000000-0000-4000-8000-000000000020"
          },
          "node": {
            "id": "20007",
            "name": "Recovery Existing Actual Preflight"
          }
        },
        {
          "workflow": {
            "code": "SHARED_STATEMENT_PIPELINE",
            "file": "03-shared-statement-pipeline.json",
            "id": "10000000-0000-4000-8000-000000000003"
          },
          "node": {
            "id": "w03-read-trusted-actual-classification",
            "name": "Read Trusted Actual Classification IDs"
          }
        }
      ]
    },
    {
      "placeholder": "BIND_CARD_PASSWORD",
      "credential_type": "financeStatementPassword",
      "node_type": "n8n-nodes-finance.financePdf",
      "nodes": [
        {
          "workflow": {
            "code": "LOCAL_PDF_EXTRACTION",
            "file": "14-local-pdf-extraction.json",
            "id": "10000000-0000-4000-8000-000000000014"
          },
          "node": {
            "id": "14003",
            "name": "Produce Ephemeral Extractable PDF"
          }
        }
      ]
    },
    {
      "placeholder": "BIND_CASHBACK_INGEST",
      "credential_type": "httpHeaderAuth",
      "node_type": "n8n-nodes-base.httpRequest",
      "nodes": [
        {
          "workflow": {
            "code": "RAKBANK_LIVE_CASHBACK",
            "file": "02-rakbank-live-cashback.json",
            "id": "10000000-0000-4000-8000-000000000002"
          },
          "node": {
            "id": "2003",
            "name": "Read Last Durable Cursor"
          }
        },
        {
          "workflow": {
            "code": "RAKBANK_LIVE_CASHBACK",
            "file": "02-rakbank-live-cashback.json",
            "id": "10000000-0000-4000-8000-000000000002"
          },
          "node": {
            "id": "2007",
            "name": "Upsert One Cashback Transaction"
          }
        },
        {
          "workflow": {
            "code": "RAKBANK_LIVE_CASHBACK",
            "file": "02-rakbank-live-cashback.json",
            "id": "10000000-0000-4000-8000-000000000002"
          },
          "node": {
            "id": "2009",
            "name": "Commit Sole Cursor Heartbeat"
          }
        },
        {
          "workflow": {
            "code": "RAKBANK_LIVE_CASHBACK",
            "file": "02-rakbank-live-cashback.json",
            "id": "10000000-0000-4000-8000-000000000002"
          },
          "node": {
            "id": "2010",
            "name": "Read Back Durable Cursor"
          }
        },
        {
          "workflow": {
            "code": "RAKBANK_LIVE_CASHBACK",
            "file": "02-rakbank-live-cashback.json",
            "id": "10000000-0000-4000-8000-000000000002"
          },
          "node": {
            "id": "w02-persist-scan-receipt",
            "name": "Persist Aggregate Scan Receipt"
          }
        },
        {
          "workflow": {
            "code": "SHARED_STATEMENT_PIPELINE",
            "file": "03-shared-statement-pipeline.json",
            "id": "10000000-0000-4000-8000-000000000003"
          },
          "node": {
            "id": "3025",
            "name": "Finalize Eligible Cashback Period"
          }
        },
        {
          "workflow": {
            "code": "SHARED_STATEMENT_PIPELINE",
            "file": "03-shared-statement-pipeline.json",
            "id": "10000000-0000-4000-8000-000000000003"
          },
          "node": {
            "id": "3066",
            "name": "Reconcile Cashback Statement"
          }
        }
      ]
    },
    {
      "placeholder": "BIND_FINANCE_MCP_FACADE",
      "credential_type": "httpBearerAuth",
      "node_type": "@n8n/n8n-nodes-langchain.mcpTrigger",
      "nodes": [
        {
          "workflow": {
            "code": "FINANCE_MCP_FACADE",
            "file": "15-finance-mcp-facade.json",
            "id": "10000000-0000-4000-8000-000000000015"
          },
          "node": {
            "id": "15001",
            "name": "Finance MCP Server Trigger"
          }
        }
      ]
    },
    {
      "placeholder": "BIND_FINANCE_OPS_DB",
      "credential_type": "postgres",
      "node_type": "n8n-nodes-base.postgres",
      "nodes": [
        {
          "workflow": {
            "code": "ACTUAL_OUTBOX_APPLY",
            "file": "20-actual-outbox-apply.json",
            "id": "10000000-0000-4000-8000-000000000020"
          },
          "node": {
            "id": "17030",
            "name": "Read Back Released Recovery Writer Fence"
          }
        },
        {
          "workflow": {
            "code": "ACTUAL_OUTBOX_APPLY",
            "file": "20-actual-outbox-apply.json",
            "id": "10000000-0000-4000-8000-000000000020"
          },
          "node": {
            "id": "20015",
            "name": "Record ISSUED Before Actual Mutation"
          }
        },
        {
          "workflow": {
            "code": "ACTUAL_OUTBOX_APPLY",
            "file": "20-actual-outbox-apply.json",
            "id": "10000000-0000-4000-8000-000000000020"
          },
          "node": {
            "id": "20017",
            "name": "Persist OUTCOME_UNKNOWN on Apply Error"
          }
        },
        {
          "workflow": {
            "code": "ACTUAL_OUTBOX_APPLY",
            "file": "20-actual-outbox-apply.json",
            "id": "10000000-0000-4000-8000-000000000020"
          },
          "node": {
            "id": "20018",
            "name": "Record VERIFIED in Durable Writer State"
          }
        },
        {
          "workflow": {
            "code": "ACTUAL_OUTBOX_APPLY",
            "file": "20-actual-outbox-apply.json",
            "id": "10000000-0000-4000-8000-000000000020"
          },
          "node": {
            "id": "20019",
            "name": "Read Back Released Recovery Writer Fence Replay"
          }
        },
        {
          "workflow": {
            "code": "ACTUAL_OUTBOX_APPLY",
            "file": "20-actual-outbox-apply.json",
            "id": "10000000-0000-4000-8000-000000000020"
          },
          "node": {
            "id": "20020",
            "name": "Record COMMITTED in Durable Writer State"
          }
        },
        {
          "workflow": {
            "code": "ACTUAL_OUTBOX_APPLY",
            "file": "20-actual-outbox-apply.json",
            "id": "10000000-0000-4000-8000-000000000020"
          },
          "node": {
            "id": "20021",
            "name": "Read Back COMMITTED Durable Writer State"
          }
        },
        {
          "workflow": {
            "code": "ACTUAL_OUTBOX_APPLY",
            "file": "20-actual-outbox-apply.json",
            "id": "10000000-0000-4000-8000-000000000020"
          },
          "node": {
            "id": "20024",
            "name": "Read Back COMMITTED Durable Writer State Replay"
          }
        },
        {
          "workflow": {
            "code": "ACTUAL_OUTBOX_APPLY",
            "file": "20-actual-outbox-apply.json",
            "id": "10000000-0000-4000-8000-000000000020"
          },
          "node": {
            "id": "20027",
            "name": "Read Back Recovered COMMITTED Writer Fence"
          }
        },
        {
          "workflow": {
            "code": "FINANCE_WRITER_LEASE",
            "file": "18-finance-writer-lease.json",
            "id": "10000000-0000-4000-8000-000000000018"
          },
          "node": {
            "id": "18004",
            "name": "Atomic Acquire Writer Lease"
          }
        },
        {
          "workflow": {
            "code": "FINANCE_WRITER_LEASE",
            "file": "18-finance-writer-lease.json",
            "id": "10000000-0000-4000-8000-000000000018"
          },
          "node": {
            "id": "18005",
            "name": "Assert Current Writer Fence"
          }
        },
        {
          "workflow": {
            "code": "FINANCE_WRITER_LEASE",
            "file": "18-finance-writer-lease.json",
            "id": "10000000-0000-4000-8000-000000000018"
          },
          "node": {
            "id": "18006",
            "name": "Release Exact Writer Fence"
          }
        }
      ]
    },
    {
      "placeholder": "BIND_N8N_API",
      "credential_type": "n8nApi",
      "node_type": "n8n-nodes-base.n8n",
      "nodes": [
        {
          "workflow": {
            "code": "FINANCE_OPERATIONS_STATUS",
            "file": "10-finance-operations-status.json",
            "id": "10000000-0000-4000-8000-000000000010"